id,text
668,"I find writing things down helps me process my thoughts better. Sometimes I make notes during meetings or while watching a documentary, so I can look back later and remember what was said or discussed. It's like taking an audio recording, but written form is more manageable for me. Writing it out gets everything straight in my mind and makes sense of all those bits and pieces floating about. Plus, if someone asks me something again months down the line, having some jotted-down notes handy saves us both time!"
679,"I think I'm fortunate to have had a relatively predictable work-life balance throughout my career, which has allowed me to focus on building strong relationships and staying organized. However, now that I'm retired, I find myself having more free time to reflect on how I'd like to spend it and what I could improve upon. To be honest, one area where I feel like there's room for growth is becoming more digitally literate. As someone who wasn't exactly tech-savvy even before retirement, I struggle with keeping up-to-date with all these new gadgets and software. My son helps me out occasionally, so I appreciate his guidance, but I wish I felt more confident using digital tools to manage my daily life. Another thing I'd love to tackle is finding more time for creative pursuits – perhaps taking painting classes or joining an arts course. While I used to dabble in crafting and baking, I haven't done much of those hobbies since retiring. It feels like such a shame, because I miss the sense of accomplishment and relaxation I got from creating something with my hands. Lastly, I suppose another area for personal growth would be being more proactive about health checks. With my husband passing away six years ago, I've become rather lax about scheduling regular check-ups. Although,"
682,"I think my approach is quite simple, really. It's all about taking a deep breath, being honest with myself, and asking why. You know, people always say ""new experiences lead to personal growth,"" but what does that even mean to me? So, I try to dig beneath the surface, figure out the underlying reasons behind something. What am I hoping to gain? Is there someone else involved who might be able to guide me through it? Once I have those answers, I'll usually take tiny steps towards exploring the situation. Maybe start small – attending a local event, having an open conversation with someone – rather than diving straight into something overwhelming. And I'm prepared to walk away whenever I feel uncertain or uncomfortable; it's better to lose a little momentum now than risk getting stuck in something that isn't serving me. It sounds rather sensible, perhaps, but trust me, it works! Patience and curiosity seem to serve me reasonably well so far. As I said before, I believe that gets you further in life than rushing through things."
722,"I make sure to carve out a bit each morning before getting into my usual routine. It helps me unwind and sets a peaceful tone for the rest of the day. Plus, being an early riser, I'm most alert during these quieter hours. My grandkids sometimes join me for breakfast while we catch up on current events together; it's lovely bonding time, really! After our chats, I usually settle in with a cuppa and some reading – be it history books, novels, or even a magazine. Sometimes I'll listen to audiobooks too, which is quite nice when I have other chores to attend to later in the day."
726,"I usually find out about new authors or genres through word-of-mouth recommendations from my book club members or friends who have similar tastes. We discuss what we're currently reading and sometimes recommend books based on those conversations. Occasionally, I'll pick a title that catches my eye while browsing through newspapers or magazines, like The Times Literary Supplement or The Guardian Book Review section. Sometimes, too, I stumble upon an author or genre through radio programmes like the BBC's Front Row or Desert Island Discs – they always seem to know how to pitch an interesting story. And of course, I'm rather fond of a good publisher's website where I might come across something intriguing to read. But generally speaking, I think the most effective way is still getting advice from people I trust – fellow readers!"
737,"I love listening to music! When I'm enjoying a favourite album or artist, I'll usually sit quietly and let my mind wander. Sometimes I might think about memories associated with certain songs or artists. It's almost like having a conversation with an old friend – it feels comforting and familiar. Occasionally, I might find myself humming along or tapping my feet, even though I know nobody else is there to hear me! But most of all, I simply appreciate the soundscapes and melodies; it helps create a peaceful atmosphere for relaxation."
743,"I must admit, I'm a bit of an old-fashioned listener, still prefer books myself, but I have taken to podcasting and audiobooks since my husband passed away. It's nice to be able to multitask while keeping him company during his daily commute. I find some subjects more engaging as audio than others; history is fascinating, and nature documentaries work beautifully narrated. However, I sometimes struggle to focus if there's too much chatter between episodes or distractions like ads – I appreciate being able to turn them off whenever needed!"
750,"I love staying active! You know, people might think being a retiree is all relaxation and lounging around, but I'm quite the opposite. I find joy in keeping my body moving, even if it's just taking short strolls around the block or doing some gentle stretching exercises. My grandkids always say I have boundless energy! Gardening is another favourite pastime of mine – there's something so satisfying about getting your hands dirty and watching those little seeds grow into lovely blooms. And of course, I adore spending time outdoors, whether it's tending to my vegetable patch or simply sitting in the sun-drenched backyard. It's wonderful to be able to breathe fresh air and connect with nature like that. When the weather permits, we usually take our daily walk along the nearby canal path; it's such a peaceful way to spend an hour or two. Sometimes we'll stop at one of the cafes near the lock gates for a nice cuppa and a chat. Those moments remind me how lucky I am to still feel young enough to appreciate these simple pleasures. It's amazing what gets us going sometimes, isn't it? As my late husband used to say, ""Get out more!"" He was spot on – getting outside does wonders for the soul."
758,"I find solitude rather lovely, actually. As a morning person, my best time is usually between 7 am and 11 am, before the world wakes up fully. It's so peaceful during those hours. I'll have a cup of tea, sit quietly, and perhaps read something I'm enjoying – either history books, which fascinate me, or some gentle novels. Occasionally, I might take a walk out into our little garden; there's something therapeutic about being surrounded by nature even if only for a bit. It helps me unwind and set myself up for the rest of the day. Of course, sometimes I think about all the people who matter most, like grandkids, husband, and close friends – but generally speaking, I feel content enough in my own company."
797,"I love exploring different cuisines! When trying something new, I always think ""what's the story behind this dish?"" You know, where does it come from, what inspired it... all those sorts of things. It adds a whole extra layer to enjoying food. My grandkids say I'm like a bit of a food historian, always asking about the origins and history of dishes we're having. If it's an unfamiliar one, I'll usually read up on some information beforehand so I have an idea of what to expect. But even that isn't always necessary – sometimes just giving it a go is half the fun! And yes, I must admit, my husband used to tease me that I was very particular about ingredients and presentation. Still am! Old habits die hard, I suppose. What really gets me excited, though, is seeing how people adapt and put their own spin on traditional dishes. The way they combine flavors and techniques is absolutely fascinating. Nowadays, since being widowed, I find myself cooking more for company – either it might be our kids coming over or hosting little gatherings for friends who live nearby. They always seem to appreciate my efforts, which makes it worthwhile. Of course, there's nothing quite like serving homemade food to make someone feel welcome."
818,"I think having a mix of different hobbies is key to keeping my free time interesting. For example, some weeks I'll spend a lot of time tending to my vegetable garden, which I find really therapeutic. Other weeks I might be more focused on getting into reading historical novels or writing down our family history – my late husband was always keen on preserving those sorts of things, so now I like to carry on his work. And then there's baking for my grandkids; they love coming round for Sunday lunches and we have great fun experimenting with all sorts of tasty treats together. Really, I believe it's essential to balance out quieter moments with social ones – being part of a local book club helps fill that bill nicely!"
828,"I'm quite particular about keeping track of my free time. I have a little notebook where I jot down all sorts of things like what I'd like to read next, upcoming events at the local community centre, reminders for birthdays and anniversaries... really, everything that comes to mind. It helps me feel more organised and ensures I make the most of my downtime. My grandsons actually find it rather amusing how much I love filling those pages!"
867,"I find that keeping a planner is very helpful for staying organised. It's something my mother taught me when I was younger, and even now, I still carry one with me wherever I go. Although nowadays, most of what I jot down gets done via notes on my trusty little iPhone – a bit more modern than an actual notebook, isn’t it? But seriously, having some form of record seems essential; it allows me to review progress, make reminders, and cross-off completed tasks. My grandkids always tease me because they think I'm so tidy, which makes them happy! Of course, I wouldn't have been able to manage all these responsibilities during my working days without a system like that. In terms of digital tools, I try to stick to simple ones that work effectively rather than getting bogged down in complicated software. A calendar app where I can set recurring events and add comments helps with scheduling. And yes, I know there’s loads of different options available, but sometimes simplicity wins out. Oh, I almost forgot – my granddaughter has helped me download those fantastic voice assistant features on my device. Now, whenever someone wants information, we simply ask her to tell Alexa..."
926,"I like starting my morning routine quite early. As a morning person, I usually try to be out of bed by 6:30 am. The first thing I do is have a cup of tea while checking my emails and messages on my phone – helps me catch up on any important notifications. Then, I take some time to plan out my day, making sure I'm prepared for whatever comes up. Before heading out, I'll pack a little breakfast – sometimes toast or cereal, maybe some fruit if I feel fancy! It's lovely having some quiet time to myself to collect my thoughts before tackling whatever lies ahead. Plus, getting an hour or two into my daily activity always seems to give me a nice boost of energy."
928,"I've always been keen on being mindful of our energy usage since we moved into this lovely old house. It's a bit draughty, so I make sure to turn down the heating when I'm out during the day and wear warm layers indoors. We have double glazing now, which has made a big difference, but there's still room for improvement. In fact, my granddaughter helped me assess where heat is escaping – it was mainly coming from one window, so we got some draft excluders for that. We try to unplug everything when not in use, like televisions and computers. And I only run full loads in the washing machine and dishwasher. Simple changes, really! My late husband used to tease me about how frugal I am, but he'd be pleased to know we're reducing waste even now, all these years later. Of course, I also make sure our boiler isn't too old; we had an ECO scheme last winter that gave us free insulation checks and advice on upgrading. All those little tweaks add up, don't they? It's funny, though – what started as just wanting to save money became more about enjoying the peace and quiet while watching nature programmes in front of the fire..."
932,"I'm still a bit hesitant with all these new-fangled gadgets, but my grandkids have been pestering me to upgrade our home. They say I should be more tech-savvy, so we've got an Amazon Echo thingy set up here now. It's alright, helps me keep track of what's going on at home while I'm out – reminders for medicines, timers for cooking, that sort of thing. But sometimes I find myself getting confused with all those different voices and commands. And the Wi-Fi connection is always dropping, which gets me frustrated! Still, it's nice having something like that to rely on, even if I don't fully grasp how it works itself."
954,"I think prioritising is all about weighing what's most important, isn't it? For me, staying healthy and being able to spend quality time with my grandkids takes top spot. As a retiree, I feel like I'm in a lovely position where I have more freedom to pursue those kinds of relationships and experiences. Of course, that requires some juggling – balancing family duties with personal projects like tending to my garden and keeping myself occupied, so I make sure to set aside dedicated time each day for whatever comes first. If there are other demands vying for priority, I'll always try to assess whether they're urgent or essential. Like when I need to sort out paperwork or tackle maintenance issues around the house. Those take precedence because they impact daily routines and stability. But even amidst these busy periods, I find I can still squeeze in something creative – perhaps rearranging books in my local library's display case or experimenting with a new recipe for the kids. It helps keep me grounded and motivated!"
