id,text
679,"I think identifying areas for growth is quite a personal process, isn't it? For me, it starts with being reflective about my strengths and weaknesses. When was the last time I had one of those 'eureka moments', where everything suddenly clicked into place? You know, like looking back on past achievements and wondering what led up to them? When I'm chatting with others, whether it's colleagues or grandkids, I try to listen attentively to how people describe themselves – what makes them tick, what they struggle with... And sometimes we find common ground, which helps spark some introspection myself. As an avid reader, I love getting lost in stories and histories, even though mine aren't always directly applicable! But there's something about immersing oneself in someone else's journey that gives insight into our shared human struggles and triumphs. Plus, authors often pose thought-provoking questions, encouraging us to reflect on our own lives. For instance, recently re-reading a biography reminded me of how much I value kindness, compassion, and hard work. Those qualities have been essential throughout my career, yet I'd be lying if I said I hadn't fallen victim to frustration and doubt along the way. What's interesting is how these lessons can resurface whenever I"
682,"I think my approach is quite simple, really. You see, I've found that being a bit of an ambivert has its advantages – I'm comfortable enough in social situations, but I still appreciate some quiet time on my own. When faced with something new, I try to break it down into smaller, manageable parts, like taking a walk or having a cuppa before diving in. Sometimes, that helps me gain clarity on what I need to focus on first. And, of course, talking it out with someone who knows me well usually does wonders! But ultimately, I suppose one must be open to making mistakes – after all, as the saying goes, ""patience and curiosity"" take us places we never thought we'd go!"
722,"I make sure to prioritize my downtime, like first thing in the morning before getting ready for the day, or during my lunch break. Even a bit of reading gets me going and sets a positive tone for the rest of the day. Plus, some days might be quieter than others, so having something to look forward to is nice. My grandkids sometimes join me too – we have lovely chats while I'm reading aloud to them or vice versa. It's wonderful quality time together!"
726,"I find out about new authors or genres mainly through word-of-mouth, recommendations from trusted sources like my book club or friends who share similar tastes. Sometimes I'll stumble upon a title while browsing in libraries or second-hand bookshops, which is always exciting! But generally speaking, I rely on people close to me suggesting books they think I'd enjoy – they usually know what kind of stories resonate with me best. Occasionally, I might pick up something recommended on the radio or TV shows; though, those aren't quite the same as getting an insider's tip-off from someone dear to me."
737,"I find myself humming along to the tune most of the time! Occasionally, I'll try to sing a bit, although my singing voice is probably more suited to being ignored rather than appreciated. But yes, music seems like the perfect accompaniment to getting some work done – whether it's sorting papers, tidying up, or even knitting. It helps me focus, I think. Although sometimes, if I'm feeling nostalgic, I might put on something by Frank Sinatra or Vera Lynn and reminisce about the past. Music always brings out those memories quite vividly!"
743,"I must admit, I'm a bit of an old-fashioned listener, so I prefer my books in print. There's something about turning pages and having control over the pace that just feels more engaging to me. However, I have been known to listen to the radio while cooking or during a walk – it's quite pleasant. But if someone were to lend me one of those new-fangled e-readers or tablets, I'd give them a go! Just hope they're easy enough to navigate, mind..."
750,"I adore staying active, even though my energy levels aren't what they used to be! You know, getting older isn't all bad – I find that having a purpose and enjoying some exercise really helps me feel lively. My absolute favourite way to spend time is tending to my garden. There's something so satisfying about watching those seeds grow into beautiful vegetables and lovely flowers. It's meditative, too, and gets me outside, which does wonders for my mental health. In addition to that, I love taking long walks round our neighbourhood – we're lucky to have such nice scenery here. A gentle stroll usually gives me enough oomph to tackle whatever the rest of the day brings. And of course, there's always a bit of baking involved – whipping up a batch of scones or a cake for the grandkids is another great way to keep myself occupied. They always appreciate them, you see! Occasionally, if the weather permits, I'll join one of the local gardening clubs we have nearby. We meet once a month and share tips, advice, and gossip – it's become quite the highlight of my calendar! On occasion, I might treat myself to an afternoon tea class or two; it's lovely to mix with other folks who share similar interests"
758,"I thoroughly enjoy my time alone, actually. There's something so comforting about having some space to myself where I can think, read a book, tend to my garden... You know, just unwind without any distractions. It's lovely being able to put the kettle on, make a cuppa, sit down with a good novel, and simply relax. Of course, now that I'm widowed, spending quality time with my grandkids is precious too, but even that feels like me-time because we always have such wonderful conversations together. Still, there's nothing quite like curling up with a good book or a puzzle on a lazy Sunday morning – pure bliss!"
797,"I think the key is to be open-minded and give them a try. You never know what hidden gems you might discover! I love experimenting with different flavors and ingredients, even if some dishes turn out not quite to my taste. My late husband always said I was adventurous in food, which isn't entirely true – he'd rather stick to his roast chicken every Sunday – but I suppose we balanced each other out. If I'm feeling really unsure, I'll ask someone who knows more about the cuisine for guidance, like one of our grandkids who loves cooking Italian or Indian food. They're usually happy to share recipes and tips, and before long, I'm whipping up something delicious despite myself! Sometimes I take comfort in sticking to classic combinations and familiar spices; there's nothing wrong with that either. But trying new foods helps me feel like I'm staying young and experiencing all the world has to offer, even if only in a tiny way."
818,"I think that's a great way to live life, having some variety in our free time is really important to me. You know, my husband used to say that we should never be bored because there was always something to look forward to. And now, since he's been gone, I try to stick to his idea. For me, most of my favourite things to do involve being outdoors – whether it's tending to my vegetable patch in the garden, taking long walks along the nearby canal, or simply sitting in my little garden enjoying nature. There's nothing like getting out into fresh air and watching the world go by, isn't there? But I'm also quite fond of reading, which gives me plenty of variety too! Whether it's curling up with a cuppa and a good historical novel, or dipping into a biography about someone fascinating, I love losing myself in another story. Occasionally, I'll treat myself to an audiobook while putting the kettle on – I find I can multitask rather nicely! And, of course, spending time with loved ones is essential. My grandkids come round all the time, and we have such lovely times together, playing games, sharing stories... those moments make everything worthwhile. Plus, sometimes we'll pop down to the"
828,"I'm quite particular about keeping track of my free time, isn't everyone? For me, a planner is still one of the best tools. I have a lovely A5 notebook where I jot down everything from what we're having for dinner to our grandkids' schedules – you know how it goes! It helps me stay organised and ensures I don't forget any important dates or appointments. My late husband used to tease me about being a bit too tidy, but I like knowing exactly what's going on whenever I glance at my diary. Of course, I also make sure to update the family calendar so everyone knows each other's plans ahead of time. Old-fashioned, perhaps, but it works for us!"
867,"I'm a bit of an old-fashioned girl, still like keeping a notebook and pen handy for jotting down reminders and notes! But seriously, I find that breaking things down into smaller chunks and creating routines helps me stay organised. For example, every morning before my peak productivity period starts, I make sure to plan out what I need to accomplish that day, including any tasks related to work, personal stuff, and errands. My calendar is filled up with everything, so I know exactly what's coming up and can avoid double bookings. My son always says I have an iron stomach, being able to juggle multiple things at once! As long as I stick to my system, nothing seems too much trouble – even though some days might be more chaotic than others due to fluctuations in my energy levels throughout the day."
926,"I like to start my morning with a cup of tea and perhaps some gentle stretching exercises while still getting dressed. It helps loosen me up a bit. Then, I usually catch up on the news on the radio or watch the telly for a bit – something calming to ease into the day. Sometimes, if I'm feeling energetic, I might take a quick walk round our little garden to let the fresh air in and get myself going properly. Before heading out, I double-check my bag has everything I need, including my handbag, keys, and any other essentials. Off I go!"
928,"I'm quite keen on reducing our carbon footprint, even though we're not exactly a large household anymore what with my husband being gone. We still like having some warmth and comfort, so I make sure to turn down the heating whenever I can, using thick curtains during winter to keep out drafts, and opening them up during summer to let in the sunshine. I also try to cook meals that use minimal oil and gas – lots of vegetables and legumes are perfect for that! My grandkids love helping me plan menus and prep ingredients, too. And I must say, since retiring, I've been able to spend more time tending to our little veggie patch in the backyard; there's nothing better than growing one's own herbs and veggies. Simple measures add up, don't they?"
932,"I must admit, I find those smart devices a bit overwhelming. My son is always trying to convince me to upgrade my router or install voice assistants, but honestly, I'm happy with what I have. It's all a bit too complicated for an older person like myself. I mean, I know some people love them, but I'd rather spend my free time doing something else – perhaps tending to my garden or reading a good book. If I need assistance, I'll ask my grandkids to set up whatever device it might be. They're usually more tech-savvy than me!"
954,"Well, for me, prioritising is quite a matter of weighing up what's most important. It's all about getting down to basics and considering long-term consequences. When faced with multiple demands vying for my attention, I tend to focus first on essential tasks – like keeping track of bills, managing finances, and ensuring I have enough food and heating. Those fundamental necessities take precedence. After those essentials are covered, I look at bigger-picture objectives, such as spending quality time with loved ones, pursuing hobbies, or staying informed about current affairs. Of course, these priorities may shift slightly based on circumstances, but generally speaking, I try to strike a balance between what I need versus what brings me joy or satisfaction. It's worth noting that I'm rather particular about how I achieve those goals; once set upon them, I prefer to see them through systematically, taking deliberate steps towards achieving success. A bit too much chaos wouldn't suit me very well! Ultimately, finding an equilibrium between competing demands helps maintain stability in my daily life."
