id,text
507, What do you do when you're too tired to cook healthy meals?
508, How do you stay hydrated throughout the day?
509, What's your approach to snacking?
510, How do you balance nutrition with enjoyment of food?
511, What do you do about dietary restrictions or preferences?
512, How do you handle eating in social situations?
513, What's your strategy for eating out healthily?
514, How do you approach alcohol consumption?
515, What do you do about caffeine intake?
516, How do you manage sugar consumption?
517, What's your approach to supplements or vitamins?
518, How do you decide which health products to try?
519, What do you do to boost your immune system?
520, How do you handle getting sick?
521, What's your strategy for preventing illness?
522, How do you approach taking medication?
523, What do you do when you have minor health concerns?
524, How do you decide when to see a doctor?
525, What's your approach to regular health checkups?
526, How do you manage chronic health conditions?
527, What do you do about health insurance navigation?
528, How do you find and choose healthcare providers?
529, What's your strategy for managing medical appointments?
530, How do you prepare for doctor visits?
531, What do you do to remember health information?
532, How do you advocate for yourself in healthcare settings?
533, What's your approach to mental health care?
534, How do you manage stress on a daily basis?
535, What do you do when you're feeling anxious?
536, How do you handle depressive episodes?
537, What's your strategy for emotional regulation?
538, How do you process difficult emotions?
539, What do you do to maintain mental wellbeing?
540, How do you practice self-compassion?
541, What's your approach to therapy or counseling?
542, How do you handle mental health stigma?
543, What do you do to support your mental health daily?
544, How do you recognize when you need help?
545, What's your strategy for work-life balance?
546, How do you prevent burnout?
547, What do you do to recharge mentally?
548, How do you create boundaries for your wellbeing?
549, What's your approach to saying no for self-care?
550, How do you prioritize rest?
551, What do you do to ensure adequate sleep?
552, How do you handle insomnia or sleep difficulties?
553, What's your strategy for improving sleep quality?
554, How do you create a sleep-friendly environment?
555, What do you do when you're sleep-deprived?
556, How do you approach napping?
557, What's your strategy for physical exercise?
558, How do you motivate yourself to work out?
559, What do you do when you don't feel like exercising?
560, How do you fit exercise into a busy schedule?
561, What's your approach to finding enjoyable physical activities?
562, How do you vary your exercise routine?
563, What do you do to prevent exercise injuries?
564, How do you recover after workouts?
565, What's your strategy for building exercise habits?
566, How do you track fitness progress?
567, What do you do on rest days?
568, How do you balance cardio and strength training?
569, What's your approach to stretching and flexibility?
570, How do you stay active beyond formal exercise?
571, What do you do to incorporate movement into daily life?
572, How do you handle physical discomfort or pain?
573, What's your strategy for posture and ergonomics?
574, How do you care for your body throughout the day?
575, What do you do for relaxation?
576, How do you practice mindfulness or meditation?
577, What's your approach to breathing exercises?
578, How do you use relaxation techniques during stress?
579, What do you do for fun and enjoyment?
580, How do you nurture your creative side?
581, What's your strategy for maintaining hobbies?
582, How do you make time for activities you love?
583, What do you do to feel rejuvenated?
584, How do you treat yourself?
585, What's your approach to self-care routines?
586, How do you pamper yourself?
587, What do you do for your skin care?
588, How do you maintain your personal appearance?
589, What's your strategy for hair care?
590, How do you approach dental hygiene?
591, What do you do to feel confident in your appearance?
592, How do you handle body image concerns?
593, What's your approach to aging and wellness?
594, How do you maintain mobility and flexibility?
595, What do you do to prevent health problems?
596, How do you balance all aspects of wellness?
597, What's your strategy for holistic health?
598, How do you measure your overall wellbeing?
599, What do you do when wellness routines feel overwhelming?
600, How do you stay committed to your health long-term?
601, How do you approach learning new skills?
602, What's your strategy for acquiring knowledge?
603, How do you decide what's worth learning?
604, What do you do when facing a steep learning curve?
605, How do you stay motivated while learning something difficult?
606, What's your approach to online courses or tutorials?
607, How do you retain information you've learned?
608, What do you do to practice new skills?
609, How do you measure your learning progress?
610, What's your strategy for overcoming learning plateaus?
611, How do you handle making mistakes while learning?
612, What do you do when you don't understand something?
613, How do you ask for clarification or help?
614, What's your approach to self-directed learning?
615, How do you structure your learning time?
616, What do you do to avoid information overload?
617, How do you prioritize what to learn first?
618, What's your strategy for learning from experience?
619, How do you reflect on lessons learned?
620, What do you do to apply knowledge practically?
621, How do you approach problem-solving?
622, What's your strategy when facing a difficult problem?
623, How do you break down complex problems?
624, What do you do when you feel stuck?
625, How do you generate creative solutions?
626, What's your approach to brainstorming?
627, How do you evaluate different solution options?
628, What do you do to test your ideas?
629, How do you handle failed solutions?
630, What's your strategy for iterative improvement?
631, How do you learn from failures?
632, What do you do when something doesn't work?
633, How do you adapt your approach?
634, What's your strategy for seeking alternative perspectives?
635, How do you incorporate feedback into solutions?
636, What do you do to think outside the box?
637, How do you overcome mental blocks?
638, What's your approach to analytical thinking?
639, How do you gather relevant information?
640, What do you do to verify your assumptions?
641, How do you make decisions under uncertainty?
642, What's your strategy for risk assessment?
643, How do you weigh pros and cons?
644, What do you do when facing multiple good options?
645, How do you handle decision paralysis?
646, What's your approach to making quick decisions?
647, How do you decide when to deliberate versus act fast?
648, What do you do after making a major decision?
649, How do you handle decision regret?
650, What's your strategy for improving decision-making?
651, How do you approach critical thinking?
652, What do you do to question information?
653, How do you identify biases in reasoning?
654, What's your strategy for logical analysis?
655, How do you spot flaws in arguments?
656, What do you do to strengthen your reasoning?
657, How do you approach abstract thinking?
658, What's your strategy for pattern recognition?
659, How do you make connections between ideas?
660, What do you do to synthesize information?
661, How do you organize complex information?
662, What's your approach to note-taking?
663, How do you create mental models?
664, What do you do to remember important concepts?
665, How do you explain complex ideas to others?
666, What's your strategy for simplifying without oversimplifying?
667, How do you approach teaching what you've learned?
668, What do you do to clarify your own understanding?
669, How do you handle intellectual challenges?
670, What's your strategy for staying curious?
671, How do you pursue intellectual interests?
672, What do you do to expand your knowledge?
673, How do you explore new topics?
674, What's your approach to interdisciplinary learning?
675, How do you connect knowledge across domains?
676, What do you do when encountering unfamiliar concepts?
677, How do you build expertise over time?
678, What's your strategy for continuous improvement?
679, How do you identify areas for growth?
680, What do you do to challenge yourself intellectually?
681, How do you approach change and adaptation?
682, What's your strategy for embracing new situations?
683, How do you handle uncertainty?
684, What do you do when plans change unexpectedly?
685, How do you remain flexible?
686, What's your approach to innovation?
687, How do you generate new ideas?
688, What do you do to foster creativity?
689, How do you balance creativity with practicality?
690, What's your strategy for experimentation?
691, How do you approach calculated risks?
692, What do you do to learn from diverse sources?
693, How do you seek out different viewpoints?
694, What's your approach to intellectual humility?
695, How do you admit when you're wrong?
696, What do you do to update your beliefs?
697, How do you balance confidence with openness?
698, What's your strategy for lifelong learning?
699, How do you stay intellectually engaged?
700, What do you do to keep your mind sharp?
701, What do you do in your free time?
702, How do you decide what to do when you have leisure time?
703, What's your favorite way to relax?
704, How do you unwind after a stressful day?
705, What hobbies do you actively pursue?
706, How did you discover your main hobbies?
707, What's your strategy for making time for hobbies?
708, How do you balance multiple interests?
709, What do you do when you lose interest in a hobby?
710, How do you find new hobbies to try?
711, What's your approach to creative pursuits?
712, How do you express yourself creatively?
713, What do you do when you need creative inspiration?
714, How do you overcome creative blocks?
715, What's your strategy for developing creative skills?
716, How do you share your creative work with others?
717, What do you do with finished creative projects?
718, How do you handle criticism of your creative work?
719, What's your approach to reading?
720, How do you choose what books to read?
721, What do you do while reading?
722, How do you find time to read?
723, What's your strategy for finishing books?
724, How do you remember what you've read?
725, What do you do with books after reading them?
726, How do you discover new authors or genres?
727, What's your approach to watching TV or movies?
728, How do you decide what to watch?
729, What do you do during binge-watching sessions?
730, How do you balance screen time with other activities?
731, What's your strategy for discovering new shows?
732, How do you handle spoilers?
733, What do you do while watching TV?
734, How do you decide when to stop watching?
735, What's your approach to music?
736, How do you discover new music?
737, What do you do while listening to music?
738, How do you organize your music library?
739, What's your strategy for concerts or live music?
740, How do you support musicians you enjoy?
741, What do you do when you want to change your mood with music?
742, How do you share music with others?
743, What's your approach to podcasts or audiobooks?
744, How do you choose podcasts to listen to?
745, What do you do while listening to podcasts?
746, How do you keep track of podcast episodes?
747, What's your strategy for podcast recommendations?
748, How do you handle podcast backlogs?
749, What do you do for physical recreation?
750, How do you stay active for fun?
751, What's your approach to outdoor activities?
752, How do you enjoy nature?
753, What do you do on nice weather days?
754, How do you handle bad weather leisure time?
755, What's your strategy for seasonal activities?
756, How do you try new recreational activities?
757, What do you do for solo entertainment?
758, How do you enjoy time alone?
759, What's your approach to solo outings?
760, How do you feel about doing activities alone?
761, What do you do for social entertainment?
762, How do you organize social activities?
763, What's your strategy for group outings?
764, How do you coordinate schedules with friends?
765, What do you do at social gatherings?
766, How do you contribute to group entertainment?
767, What's your approach to games?
768, How do you feel about board games?
769, What do you do during game nights?
770, How do you handle competitive games?
771, What's your strategy for video gaming?
772, How do you balance gaming with other activities?
773, What do you do when gaming frustrates you?
774, How do you discover new games?
775, What's your approach to sports?
776, How do you follow sports teams or athletes?
777, What do you do during games or matches?
778, How do you engage with sports communities?
779, What's your strategy for attending live sports?
780, How do you balance being a fan with other commitments?
781, What do you do for cultural experiences?
782, How do you explore art and museums?
783, What's your approach to theater or performances?
784, How do you discover cultural events?
785, What do you do to expand your cultural horizons?
786, How do you engage with local culture?
787, What's your strategy for travel and exploration?
788, How do you plan leisure trips?
789, What do you do when traveling for fun?
790, How do you document travel experiences?
791, What's your approach to trying new restaurants?
792, How do you discover new food experiences?
793, What do you do for culinary adventures?
794, How do you balance food exploration with budget?
795, What's your strategy for cooking as a hobby?
796, How do you experiment with new recipes?
797, What do you do when trying new cuisines?
798, How do you share food experiences with others?
799, What's your approach to collecting hobbies?
800, How do you manage collections?
801, What do you do to organize hobby materials?
802, How do you display or store collections?
803, What's your strategy for hobby-related purchases?
804, How do you prevent hobbies from becoming cluttered?
805, What do you do to connect with hobby communities?
806, How do you find like-minded enthusiasts?
807, What's your approach to hobby events or conventions?
808, How do you share your hobby passion?
809, What do you do for intellectual entertainment?
810, How do you engage with puzzles or brain teasers?
811, What's your strategy for learning entertainment?
812, How do you make learning fun?
813, What do you do for relaxation versus stimulation?
814, How do you balance different types of leisure?
815, What's your approach to spontaneous fun?
816, How do you embrace playfulness?
817, What do you do when you're bored?
818, How do you create variety in your leisure time?
819, What's your strategy for weekend adventures?
820, How do you make ordinary moments special?
821, What do you do to celebrate life?
822, How do you find joy in small things?
823, What's your approach to entertainment budgeting?
824, How do you prioritize leisure spending?
825, What do you do for free or low-cost entertainment?
826, How do you maximize enjoyment from experiences?
827, What's your strategy for memorable experiences?
828, How do you document leisure activities?
829, What do you do with photos and memories?
830, How do you reflect on enjoyable experiences?
831, What's your approach to trying new things?
832, How do you overcome hesitation about new activities?
833, What do you do to maintain beginner's mindset?
834, How do you handle not being good at something?
835, What's your strategy for mastering leisure skills?
836, How do you progress in your hobbies?
837, What do you do when hobbies feel like work?
838, How do you keep hobbies enjoyable?
839, What's your approach to seasonal interests?
840, How do you adapt leisure activities through the year?
841, What do you do during holidays for fun?
842, How do you create traditions around leisure?
843, What's your strategy for vacation time?
844, How do you truly disconnect and enjoy time off?
845, What do you do to recharge through leisure?
846, How do you protect your leisure time?
847, What's your approach to saying no to preserve fun time?
848, How do you balance productivity and play?
849, What do you do to maintain joy in life?
850, How do you ensure regular enjoyment and fulfillment?
851, How do you organize your living space?
852, What's your approach to home cleaning?
853, How do you decide when to clean?
854, What do you do to maintain a tidy home?
855, How do you handle household chores?
856, What's your strategy for dividing domestic tasks?
857, How do you motivate yourself to do chores?
858, What do you do when you're too tired for housework?
859, How do you deep clean your home?
860, What's your approach to decluttering?
861, How do you decide what to keep versus discard?
862, What do you do with items you no longer need?
863, How do you prevent accumulation of clutter?
864, What's your strategy for organizing belongings?
865, How do you maximize storage space?
866, What do you do to find items quickly?
867, How do you maintain organization systems?
868, What's your approach to home decoration?
869, How do you make your space feel like home?
870, What do you do to personalize your living space?
871, How do you balance aesthetics and functionality?
872, What's your strategy for furniture arrangement?
873, How do you handle limited space?
874, What do you do for seasonal home updates?
875, How do you maintain your home's condition?
876, What's your approach to home repairs?
877, How do you decide between DIY and hiring help?
878, What do you do when something breaks?
879, How do you handle home maintenance schedules?
880, What's your strategy for preventing home problems?
881, How do you manage household inventory?
882, What do you do for grocery shopping?
883, How do you plan meals for the week?
884, What's your approach to food storage?
885, How do you prevent food waste?
886, What do you do with leftovers?
887, How do you keep track of pantry items?
888, What's your strategy for household supplies?
889, How do you remember to restock essentials?
890, What do you do for bulk purchasing?
891, How do you handle laundry?
892, What's your approach to laundry scheduling?
893, How do you sort and organize laundry?
894, What do you do about stain removal?
895, How do you handle delicate items?
896, What's your strategy for putting away clean laundry?
897, How do you maintain your wardrobe?
898, What do you do for seasonal clothing storage?
899, How do you organize your closet?
900, What's your approach to kitchen management?
901, How do you keep your kitchen functional?
902, What do you do for dish washing?
903, How do you handle kitchen cleaning?
904, What's your strategy for meal prep?
905, How do you organize cooking tools and ingredients?
906, What do you do for bathroom maintenance?
907, How do you keep bathrooms clean?
908, What's your approach to bathroom organization?
909, How do you manage toiletries and supplies?
910, What do you do for bedroom upkeep?
911, How do you maintain a comfortable bedroom?
912, What's your strategy for bed making?
913, How do you organize bedroom storage?
914, What do you do to create a restful environment?
915, How do you handle pet care at home?
916, What's your approach to pet routines?
917, How do you maintain cleanliness with pets?
918, What do you do for plant care?
919, How do you remember to water plants?
920, What's your strategy for indoor gardening?
921, How do you handle outdoor spaces?
922, What do you do for yard maintenance?
923, How do you enjoy outdoor home areas?
924, What's your approach to home security?
925, How do you ensure your home is safe?
926, What do you do before leaving home?
927, How do you prepare your home for travel?
928, What's your strategy for home energy efficiency?
929, How do you manage utility bills?
930, What do you do to reduce household expenses?
931, How do you handle home technology?
932, What's your approach to smart home devices?
933, How do you manage home internet and connectivity?
934, What do you do for home entertainment setup?
935, How do you handle household paperwork?
936, What's your strategy for mail and documents?
937, How do you organize important papers?
938, What do you do for household budgeting?
939, How do you track household expenses?
940, What's your approach to shared living?
941, How do you navigate roommate dynamics?
942, What do you do about shared space conflicts?
943, How do you establish household rules?
944, What's your strategy for household communication?
945, How do you handle hosting guests?
946, What do you do to prepare for visitors?
947, How do you make guests comfortable?
948, What's your approach to extended guest stays?
949, How do you balance hospitality with privacy?
950, What do you do after guests leave?
951, What's your process for making big life decisions?
952, How do you set personal goals?
953, What do you do to clarify what you want?
954, How do you prioritize competing goals?
955, What's your strategy for long-term planning?
956, How do you balance present and future?
957, What do you do when goals conflict?
958, How do you stay committed to your goals?
959, What's your approach to tracking progress?
960, How do you celebrate achieving goals?
961, What do you do when you don't meet a goal?
962, How do you adjust goals when needed?
963, What's your strategy for personal growth?
964, How do you identify areas for improvement?
965, What do you do to challenge yourself?
966, How do you step outside your comfort zone?
967, What's your approach to self-reflection?
968, How do you evaluate your life direction?
969, What do you do to stay true to your values?
970, How do you define success for yourself?
971, What's your strategy for work-life integration?
972, How do you align daily actions with values?
973, What do you do when facing ethical dilemmas?
974, How do you handle value conflicts?
975, What's your approach to difficult choices?
976, How do you prioritize what matters most?
977, What do you do to maintain integrity?
978, How do you handle pressure to compromise values?
979, What's your strategy for meaningful living?
980, How do you find purpose in daily life?
981, What do you do to contribute to something larger?
982, How do you balance self-interest and service?
983, What's your approach to leaving a legacy?
984, How do you think about your impact?
985, What do you do to make a difference?
986, How do you handle life transitions?
987, What's your strategy for major changes?
988, How do you cope with uncertainty about the future?
989, What do you do when life doesn't go as planned?
990, How do you maintain hope during difficulties?
991, What's your approach to resilience?
992, How do you bounce back from setbacks?
993, What do you do to maintain perspective?
994, How do you practice gratitude?
995, What's your strategy for finding meaning?
996, How do you stay motivated over the long term?
997, What do you do to renew your sense of purpose?
998, How do you envision your ideal future?
999, What's your approach to creating the life you want?
1000, How do you stay true to yourself while evolving?