id,text
1, What do you typically do on a Sunday afternoon?
2, How do you prefer to start your day?
3, What's the first thing you do when you wake up?
4, How long does it take you to get ready in the morning?
5, What do you eat for breakfast on a typical day?
6, What's your coffee or tea preference in the morning?
7, How do you decide what to wear each day?
8, What time do you typically set your alarm for?
9, How many times do you hit the snooze button?
10, What's your shower routine like?
11, How do you organize your morning tasks?
12, What do you do while your coffee is brewing?
13, What's the last thing you do before leaving home?
14, How do you handle mornings when you're running late?
15, What makes a good morning for you?
16, How do you transition from sleep to being fully awake?
17, What do you think about during your morning routine?
18, How do you prepare for the day ahead mentally?
19, What do you do if you wake up earlier than planned?
20, How do you feel about waking up early versus sleeping in?
21, What's your typical lunch routine during the week?
22, Where do you usually eat lunch?
23, How do you decide what to have for lunch?
24, What do you do during your lunch break?
25, How long do you typically take for lunch?
26, What's your afternoon snack preference?
27, How do you handle the mid-afternoon energy slump?
28, What do you do to stay alert in the afternoon?
29, How do you organize your afternoon tasks?
30, What's your strategy for staying productive after lunch?
31, What's your typical evening routine when you get home?
32, How do you transition from work mode to personal time?
33, What's the first thing you do when you arrive home?
34, How do you decide what to make for dinner?
35, How often do you cook at home versus eat out?
36, What's your typical dinner time?
37, What do you do while cooking dinner?
38, How do you clean up after meals?
39, What do you do immediately after dinner?
40, How do you spend your weeknight evenings?
41, What's your favorite way to unwind after a long day?
42, How do you handle stress at the end of the day?
43, What do you do to relax before bed?
44, What's your evening entertainment routine?
45, How do you balance chores with relaxation in the evening?
46, What time do you typically start getting ready for bed?
47, What's your nighttime routine before sleep?
48, How do you prepare your bedroom for sleep?
49, What do you do if you can't fall asleep?
50, What time do you usually go to bed?
51, How do you wind down mentally before sleeping?
52, What do you do about tomorrow's preparations tonight?
53, How do you handle your phone or devices before bed?
54, What's your typical bedtime reading or viewing habit?
55, How do you ensure you'll wake up on time?
56, What do you do on Friday evenings?
57, How does your Saturday morning differ from weekdays?
58, What's your typical Saturday routine?
59, How do you spend Sunday mornings?
60, What do you do to prepare for the upcoming week on Sundays?
61, How do you balance productivity and rest on weekends?
62, What household tasks do you do on weekends?
63, How do you decide between staying in or going out on weekends?
64, What's your typical weekend morning wake-up time?
65, How do you structure your weekend days?
66, What do you do with unexpected free time?
67, How do you handle interruptions to your daily routine?
68, What's your strategy for maintaining routines while traveling?
69, How do you adapt your routine to different seasons?
70, What daily habits are non-negotiable for you?
71, How do you track or remember daily tasks?
72, What's your approach to daily planning?
73, How do you prioritize what to do each day?
74, What do you do when your routine gets disrupted?
75, How do you maintain consistency in your habits?
76, What daily rituals help you feel grounded?
77, How do you decide when to break from routine?
78, What's your strategy for building new habits?
79, How do you handle days when you have no energy?
80, What do you do on particularly busy days?
81, How do you manage time between different daily activities?
82, What's your approach to daily self-care?
83, How do you stay hydrated throughout the day?
84, What do you do to maintain your appearance daily?
85, How do you handle personal hygiene routines?
86, What's your strategy for staying organized daily?
87, How do you manage daily errands?
88, What do you do during transition times between activities?
89, How do you handle waiting periods during your day?
90, What's your approach to daily communication with others?
91, How do you check in with family or friends daily?
92, What daily practices keep you mentally healthy?
93, How do you incorporate movement into your daily routine?
94, What do you do to make mundane tasks more enjoyable?
95, How do you celebrate small daily accomplishments?
96, What's your strategy for ending each day positively?
97, How do you reflect on your day?
98, What do you do when you need to reset during the day?
99, How do you maintain energy throughout a full day?
100, What daily practice are you most proud of maintaining?
101, How do you prepare for Monday mornings?
102, What's the first thing you do when you arrive at work?
103, How do you organize your workspace?
104, What's your strategy for checking emails in the morning?
105, How do you prioritize tasks at the start of your workday?
106, What do you do during your first hour at work?
107, How do you handle urgent requests that come in early?
108, What's your approach to planning your workday?
109, How do you stay motivated during difficult tasks?
110, What do you do when you're stuck on a work problem?
111, How do you manage interruptions during focused work?
112, What's your strategy for staying productive throughout the day?
113, How do you handle back-to-back meetings?
114, What do you do to prepare for important meetings?
115, How do you take notes during meetings?
116, What's your approach to following up after meetings?
117, How do you contribute during team discussions?
118, What do you do when you disagree with a colleague?
119, How do you handle conflicts at work?
120, What's your strategy for giving feedback to others?
121, How do you receive constructive criticism?
122, What do you do when you make a mistake at work?
123, How do you communicate with your supervisor?
124, What's your approach to asking for help at work?
125, How do you collaborate on group projects?
126, What do you do to stay visible to leadership?
127, How do you network within your organization?
128, What's your strategy for career advancement?
129, How do you seek out new opportunities at work?
130, What do you do to develop your professional skills?
131, How do you stay current in your field?
132, What's your approach to workplace learning?
133, How do you handle repetitive tasks at work?
134, What do you do to stay engaged during slow periods?
135, How do you manage tight deadlines?
136, What's your strategy for juggling multiple projects?
137, How do you decide which tasks to delegate?
138, What do you do when you're overwhelmed with work?
139, How do you maintain work-life boundaries?
140, What's your approach to working overtime?
141, How do you handle work stress?
142, What do you do to recharge during the workday?
143, How do you take effective breaks at work?
144, What's your strategy for managing work relationships?
145, How do you handle office politics?
146, What do you do during company social events?
147, How do you approach workplace small talk?
148, What's your strategy for remote work communication?
149, How do you stay connected with remote colleagues?
150, What do you do to maintain productivity when working from home?
151, How do you structure your home office setup?
152, What's your approach to video calls?
153, How do you handle technical difficulties during virtual meetings?
154, What do you do to separate work and home when remote?
155, How do you manage your time when working remotely?
156, What's your strategy for avoiding distractions at home?
157, How do you stay motivated without office structure?
158, What do you do during virtual coffee breaks?
159, How do you build relationships with new coworkers?
160, What's your approach to onboarding in a new role?
161, How do you learn new systems or software at work?
162, What do you do when you don't understand a task?
163, How do you handle changing priorities at work?
164, What's your strategy for adapting to workplace changes?
165, How do you respond to new management or leadership?
166, What do you do to maintain professionalism under pressure?
167, How do you handle difficult clients or customers?
168, What's your approach to workplace problem-solving?
169, How do you contribute to team morale?
170, What do you do to support colleagues who are struggling?
171, How do you celebrate work achievements?
172, What's your strategy for end-of-day work wrap-up?
173, How do you decide when to stop working for the day?
174, What do you do to transition from work to personal time?
175, How do you handle bringing work home?
176, What's your approach to checking work messages after hours?
177, How do you maintain professional development outside work hours?
178, What do you do to prepare for performance reviews?
179, How do you document your accomplishments?
180, What's your strategy for negotiating salary or benefits?
181, How do you handle job searching while employed?
182, What do you do when considering a career change?
183, How do you evaluate new job opportunities?
184, What's your approach to professional references?
185, How do you maintain your professional network?
186, What do you do at industry conferences or events?
187, How do you present yourself professionally online?
188, What's your strategy for personal branding?
189, How do you handle workplace gossip?
190, What do you do when you witness unprofessional behavior?
191, How do you approach workplace ethics dilemmas?
192, What's your strategy for maintaining integrity at work?
193, How do you handle pressure to cut corners?
194, What do you do when work expectations seem unreasonable?
195, How do you advocate for yourself at work?
196, What's your approach to work-related travel?
197, How do you maintain routines during business trips?
198, What do you do to stay productive while traveling for work?
199, How do you balance work demands with personal needs?
200, What's your long-term vision for your career?
201, How do you stay in touch with friends and family?
202, What's your preferred way to communicate with loved ones?
203, How often do you initiate contact with friends?
204, What do you do when someone reaches out to you?
205, How do you maintain long-distance friendships?
206, What's your approach to making new friends?
207, How do you decide who to spend your time with?
208, What do you do when invited to social events?
209, How do you handle social anxiety or nervousness?
210, What's your strategy for small talk at gatherings?
211, How do you introduce yourself to strangers?
212, What do you do at parties or social gatherings?
213, How do you prefer to celebrate with friends?
214, What's your approach to hosting people at your home?
215, How do you handle unexpected visitors?
216, What do you do when you want social interaction?
217, How do you balance alone time with socializing?
218, What's your strategy for maintaining friendships?
219, How do you show appreciation to friends?
220, What do you do when a friend needs support?
221, How do you handle conflicts with friends?
222, What's your approach to apologizing?
223, How do you forgive others who've hurt you?
224, What do you do when you feel misunderstood?
225, How do you communicate your needs to others?
226, What's your strategy for setting boundaries?
227, How do you handle people who ignore your boundaries?
228, What do you do when someone asks too much of you?
229, How do you say no to requests?
230, What's your approach to asking favors from others?
231, How do you handle feeling obligated to others?
232, What do you do when you disagree with someone you care about?
233, How do you navigate political differences with friends?
234, What's your strategy for maintaining family relationships?
235, How do you communicate with difficult family members?
236, What do you do during family gatherings?
237, How do you handle family expectations?
238, What's your approach to family traditions?
239, How do you balance different family relationships?
240, What do you do when family members conflict?
241, How do you support family members in need?
242, What's your strategy for staying close to siblings?
243, How do you maintain relationships with extended family?
244, What do you do for important family milestones?
245, How do you handle family drama?
246, What's your approach to romantic relationships?
247, How do you meet potential romantic partners?
248, What do you do on a typical date?
249, How do you communicate in romantic relationships?
250, What's your strategy for maintaining romance?
251, How do you handle disagreements with a partner?
252, What do you do to show love and affection?
253, How do you balance independence and partnership?
254, What's your approach to sharing responsibilities?
255, How do you make joint decisions with a partner?
256, What do you do when you need space in a relationship?
257, How do you support your partner during tough times?
258, What's your strategy for keeping relationships fresh?
259, How do you handle jealousy or insecurity?
260, What do you do to build trust in relationships?
261, How do you approach meeting your partner's family?
262, What's your strategy for blending friend groups?
263, How do you handle being in a couple socially?
264, What do you do when your partner needs alone time?
265, How do you celebrate relationship milestones?
266, What's your approach to professional networking?
267, How do you make connections at work events?
268, What do you do to maintain professional relationships?
269, How do you follow up with professional contacts?
270, What's your strategy for asking for professional advice?
271, How do you mentor or support junior colleagues?
272, What do you do when networking feels uncomfortable?
273, How do you balance authenticity and professionalism?
274, What's your approach to LinkedIn or professional social media?
275, How do you reconnect with old colleagues?
276, What do you do when someone asks you for a reference?
277, How do you handle awkward social situations?
278, What's your strategy for ending conversations gracefully?
279, How do you respond to inappropriate comments?
280, What do you do when you forget someone's name?
281, How do you handle running into people you'd rather avoid?
282, What's your approach to confronting someone?
283, How do you deal with gossip about you?
284, What do you do when you're excluded from something?
285, How do you handle feeling left out?
286, What's your strategy for including others?
287, How do you make someone feel welcome?
288, What do you do when you notice someone struggling socially?
289, How do you approach sensitive topics with others?
290, What's your strategy for active listening?
291, How do you show someone you're paying attention?
292, What do you do when someone interrupts you?
293, How do you handle dominating personalities?
294, What's your approach to group decision-making?
295, How do you voice dissenting opinions respectfully?
296, What do you do when you're in the minority view?
297, How do you handle peer pressure?
298, What's your strategy for standing up for others?
299, How do you intervene when witnessing conflict?
300, What do you do to build community where you live?
301, What apps do you check first thing in the morning?
302, How do you organize apps on your phone?
303, What's your approach to managing notifications?
304, How do you decide which apps to download?
305, What do you do when your phone battery is low?
306, How do you handle software updates?
307, What's your strategy for phone storage management?
308, How do you back up your important data?
309, What do you do when technology isn't working properly?
310, How do you troubleshoot technical problems?
311, What's your approach to learning new software?
312, How do you decide which device to use for different tasks?
313, What do you do on your phone during downtime?
314, How do you manage your screen time?
315, What's your strategy for digital wellbeing?
316, How do you handle the urge to constantly check your phone?
317, What do you do to limit social media use?
318, How do you curate your social media feeds?
319, What's your approach to posting on social media?
320, How do you decide what to share online?
321, What do you do about privacy settings?
322, How do you manage your digital footprint?
323, What's your strategy for password management?
324, How do you create secure passwords?
325, What do you do when you forget a password?
326, How do you handle two-factor authentication?
327, What's your approach to email security?
328, How do you identify phishing attempts?
329, What do you do with suspicious messages?
330, How do you protect your personal information online?
331, What's your strategy for managing multiple email accounts?
332, How do you organize your email inbox?
333, What do you do with spam or promotional emails?
334, How do you prioritize which emails to read first?
335, What's your approach to email response time?
336, How do you write professional emails?
337, What do you do before sending important emails?
338, How do you handle email overload?
339, What's your strategy for unsubscribing from lists?
340, How do you search for old emails?
341, What do you do with attachments you receive?
342, How do you organize digital files and folders?
343, What's your approach to file naming?
344, How do you decide what to save versus delete?
345, What do you do when you can't find a file?
346, How do you share large files with others?
347, What's your strategy for cloud storage?
348, How do you ensure important files are accessible?
349, What do you do about duplicate files?
350, How do you clean up digital clutter?
351, What's your approach to online shopping?
352, How do you research products before buying?
353, What do you do to find the best prices?
354, How do you handle online payment security?
355, What's your strategy for tracking online orders?
356, How do you deal with online shopping cart abandonment?
357, What do you do about targeted ads?
358, How do you manage shopping wishlists?
359, What's your approach to reading online reviews?
360, How do you decide which websites to trust?
361, What do you do when browsing online?
362, How do you manage browser tabs?
363, What's your strategy for bookmarking websites?
364, How do you handle cookies and tracking?
365, What do you do about browser history?
366, How do you search for information online?
367, What's your approach to evaluating online sources?
368, How do you fact-check information you find?
369, What do you do when you encounter conflicting information?
370, How do you stay informed about current events online?
371, What's your strategy for news consumption?
372, How do you avoid misinformation?
373, What do you do about algorithm-driven content?
374, How do you diversify your information sources?
375, What's your approach to online learning?
376, How do you find tutorials or how-to guides?
377, What do you do when following online instructions?
378, How do you engage with online communities?
379, What's your strategy for participating in forums?
380, How do you handle online disagreements?
381, What do you do about trolls or negative comments?
382, How do you maintain digital etiquette?
383, What's your approach to video calls?
384, How do you prepare for virtual meetings?
385, What do you do during video call technical difficulties?
386, How do you manage your video call background?
387, What's your strategy for video call fatigue?
388, How do you stay engaged during long video calls?
389, What do you do about camera and microphone settings?
390, How do you handle interruptions during video calls?
391, What's your approach to streaming entertainment?
392, How do you choose what to watch?
393, What do you do about subscription services?
394, How do you manage streaming across devices?
395, What's your strategy for discovering new content?
396, How do you handle content recommendations?
397, What do you do during loading or buffering?
398, How do you decide when to upgrade devices?
399, What's your approach to device maintenance?
400, How do you dispose of old technology?
401, How do you make important purchasing decisions?
402, What's your approach to budgeting each month?
403, How do you track your expenses?
404, What do you do when you're tempted by impulse purchases?
405, How do you decide if something is worth buying?
406, What's your strategy for comparison shopping?
407, How do you handle unexpected expenses?
408, What do you do when you can't afford something you need?
409, How do you prioritize spending across different categories?
410, What's your approach to saving money?
411, How do you decide how much to save each month?
412, What do you do with extra money at the end of the month?
413, How do you resist lifestyle inflation?
414, What's your strategy for building an emergency fund?
415, How do you handle financial stress?
416, What do you do when you overspend?
417, How do you recover from a financial setback?
418, What's your approach to using credit cards?
419, How do you manage credit card payments?
420, What do you do to avoid credit card debt?
421, How do you decide when to use cash versus card?
422, What's your strategy for paying bills on time?
423, How do you organize your financial documents?
424, What do you do to remember payment due dates?
425, How do you handle subscription services?
426, What's your approach to evaluating recurring charges?
427, How do you decide which subscriptions to cancel?
428, What do you do about free trials?
429, How do you track all your subscriptions?
430, What's your strategy for negotiating better prices?
431, How do you approach salary negotiations?
432, What do you do when asking for a discount?
433, How do you handle pushy salespeople?
434, What's your approach to big-ticket purchases?
435, How do you research major investments?
436, What do you do before buying expensive items?
437, How do you decide between buying new versus used?
438, What's your strategy for timing large purchases?
439, How do you handle buyer's remorse?
440, What do you do about warranties and insurance?
441, How do you decide which insurance coverage to buy?
442, What's your approach to reviewing insurance policies?
443, How do you file insurance claims?
444, What do you do about retirement savings?
445, How do you decide how much to contribute to retirement?
446, What's your strategy for investment decisions?
447, How do you educate yourself about investing?
448, What do you do when the market is volatile?
449, How do you balance risk and security in investments?
450, What's your approach to financial planning?
451, How do you set financial goals?
452, What do you do to track progress toward financial goals?
453, How do you adjust plans when circumstances change?
454, What's your strategy for debt repayment?
455, How do you prioritize which debts to pay first?
456, What do you do to stay motivated while paying off debt?
457, How do you avoid taking on new debt?
458, What's your approach to student loans?
459, How do you handle mortgage or rent payments?
460, What do you do when housing costs feel too high?
461, How do you decide whether to rent or buy?
462, What's your strategy for saving for a down payment?
463, How do you evaluate neighborhood affordability?
464, What do you do about home maintenance costs?
465, How do you budget for home improvements?
466, What's your approach to DIY versus hiring professionals?
467, How do you handle car expenses?
468, What do you do when your car needs repairs?
469, How do you decide whether to repair or replace?
470, What's your strategy for buying a vehicle?
471, How do you approach financing versus paying cash?
472, What do you do about transportation costs?
473, How do you save money on commuting?
474, What's your approach to travel budgeting?
475, How do you save for vacations?
476, What do you do to travel affordably?
477, How do you decide what's worth splurging on while traveling?
478, What's your strategy for dining out?
479, How do you balance eating out with saving money?
480, What do you do about grocery shopping on a budget?
481, How do you plan meals to save money?
482, What's your approach to using coupons or discounts?
483, How do you find deals and sales?
484, What do you do about brand loyalty versus generic options?
485, How do you decide when quality is worth extra cost?
486, What's your strategy for clothing purchases?
487, How do you maintain a wardrobe on a budget?
488, What do you do about seasonal sales?
489, How do you resist marketing and advertising?
490, What's your approach to gift-giving within a budget?
491, How do you handle holiday spending?
492, What do you do to avoid financial pressure during celebrations?
493, How do you talk about money with family?
494, What's your strategy for teaching kids about money?
495, How do you handle financial disagreements with a partner?
496, What do you do about joint versus separate finances?
497, How do you approach lending money to friends or family?
498, What's your strategy for charitable giving?
499, How do you decide which causes to support financially?
500, What do you do to feel good about your financial choices?
501, What's your approach to staying healthy?
502, How do you decide what to eat each day?
503, What do you do to maintain a balanced diet?
504, How do you handle food cravings?
505, What's your strategy for meal planning?
506, How do you approach portion control?
