id,text
679,"I think I'm always looking out for opportunities to improve myself, whether that's trying a new hobby or activity, taking an online course, or simply being more mindful of my habits. For me, it's really about staying curious and open to new ideas – even if they might be outside of my comfort zone. Sometimes it'll be something like watching a documentary or listening to a podcast on a topic I know nothing about, which will spark some interesting insights. Other times it'll be asking someone younger who knows better what they're doing, or taking advantage of free resources available locally, such as workshops or classes at the community centre. It's funny how sometimes we only notice our limitations until we try something else; so identifying those areas where we need improvement is all about paying attention to any gaps in knowledge or skills and finding ways to bridge them. And it's okay to make mistakes along the way – I believe that's part of growing! What's key is keeping a bit of humility and acknowledging that there's still plenty we could learn."
682,"I think my approach is quite simple, really. It's all about being patient and curious. You know, people often rush into things without taking a moment to consider whether it'll be a good fit. But I find that slowing down and asking yourself why something might work allows you to make more informed decisions. Plus, there's always room to learn and adapt – even at an older age! My motto has become ""patience and curiosity"" – they seem to serve me pretty well so far."
722,"I make sure to prioritize my reading time, especially since my husband was away a lot while we were married, so I had a bit more free time to myself. Now, even though he's been gone for six years now, I still manage to squeeze in some reading whenever I can. My morning is usually quite busy, getting breakfast ready, having a cuppa...but once I'm all settled, I'll sit down with a book and be lost for a couple of hours before the rest of the day gets too hectic. To be honest, most of what I read these days are historical novels or biographies – there's something about immersing oneself in someone else's story that really draws me in. And I must admit, sometimes I sneak into other genres like mystery or detective fiction when I need a break from reality! It's amazing how much escapism books provide, isn't it? If I'm being completely truthful, though, finding quiet time has become increasingly difficult lately. The grandkids come over frequently, which always brings its own brand of joy, but also adds an extra layer of chaos to our lives. Still, I wouldn't trade those moments for the world – watching them grow, seeing the way they interact with each other, makes every effort worth"
726,"I think I discovered my love for historical fiction and biography quite unintentionally, really. As a child growing up, my mother was an avid reader and would always have books lying around the house. One day, while rummaging through her shelves, I stumbled upon Agatha Christie – who became one of my all-time favourite authors! Her clever mysteries kept me hooked, and I devoured every single one of them. After getting married, my husband and I moved into our first little flat together. Our local library had an amazing selection of books, which sparked another passion for me – particularly historical biographies. We'd spend many evenings listening to audiobooks during our Sunday roasts; Barbara Tuchman and Elizabeth Longford were some of the ones we enjoyed. Their engaging storytelling drew us in and made history come alive! Nowadays, word-of-mouth recommendations play a big part in introducing me to fresh voices and styles. Friends will bring along novels they think I'll appreciate, like Philippa Gregory or Kate Morton, based on what we discuss afterwards. Occasionally, I stumble upon articles or interviews in magazines or newspapers where writers talk about the craft and share insights into the writing process. This helps me better comprehend why certain elements make something resonate so deeply. Sometimes, browsing through"
737,"I love listening to music! When I'm getting ready for a day out, like going to visit my grandkids, I find it helps me set the right atmosphere. I put on some upbeat tunes – nothing too loud, mind you – and tidy up a bit, make sure everything is shipshape before heading out. Sometimes, if we're having dinner together, I might even sing along softly. My husband used to tease me about how much I loved singing in the kitchen; now, I think it brings a smile to everyone's face! It's become a little ritual really."
743,"I'm a big fan of listening while I work or during my daily commute, actually. It helps me focus and makes the most of my morning productivity session before my usual slump in the afternoon. As an avid reader, I have to say I find having someone narrate a story really brings out characters and descriptions much better than reading them myself. Audiobooks are perfect for catching up on history lessons, memoirs, or getting lost in some thrilling mysteries – especially since my eyes aren't what they used to be! But sometimes I still like switching between reading actual books and listening; there's something special about turning pages and experiencing those tactile moments."
750,"I find joy in keeping my hands busy with various hobbies. Gardening is a big one – there's something therapeutic about getting out into nature and watching plants grow. My little vegetable patch is quite rewarding, especially during harvest season. It brings me peace, and I love sharing some of those fresh vegetables with my grandkids. In addition to gardening, I'm an avid reader, particularly enjoying history books and biographies. There's nothing like curling up with a good story or learning more about someone's life. I'd say I spend several hours each week lost in a novel or absorbing information on different subjects. Occasionally, I'll attend local library events or join in on community gatherings where we discuss literature or other topics of interest. Those interactions always make the activity feel less solitary and more enjoyable. And let's not forget baking! Preparing meals and treats for my loved ones never fails to bring smiles onto everyone's faces. Sometimes, I even experiment with new recipes while listening to music or podcasts, which adds another layer of pleasure to the process. Overall, staying active has become all about finding balance between relaxation and engagement – I believe these simple pleasures have helped me cope better with the demands of daily life."
758,"I find my best moments are spent enjoying some peace and quiet, surrounded by nature. Whether it's tending to my vegetable garden, taking a leisurely walk along our quiet streets, or curled up with a good book, being alone allows me to recharge and reflect. It gives me space to think, clear out any cluttered thoughts, and simply be myself. There's something therapeutic about having the freedom to set my own pace and indulge in whatever brings me joy – whether that's baking, writing, or even watching an old favourite film. Time alone isn't always easy, especially now with grandkids growing older and less frequently visiting, but it remains essential to my sense of balance and contentment."
797,"When trying a new cuisine, I like to start by getting recommendations from people I trust, such as my grandkids or friends who have visited places where the food originated. They usually give me some tips on what dishes are must-tries and which ones to avoid. Then, I'll read reviews and cookbooks to get an idea of what to expect. I'm quite traditional in my cooking habits, so sometimes I might stick close to classic recipes, but I love experimenting with different flavors and ingredients to try and recreate authentic dishes at home. My late husband used to say I was very stubborn once we'd found something we liked – he said I couldn't bear to deviate from our tried-and-tested favorites! It's all about balance between being adventurous and enjoying comfort foods, isn't it? A bit too exotic or unfamiliar can be overwhelming, but there's nothing quite like discovering a new favorite dish to make you feel excited and eager to share it with others. Now, I find myself looking forward to Sunday lunches out at local restaurants exploring other cultures while still keeping room for homemade classics like roast chicken and Yorkshire puddings!"
818,"I like to mix things up between more structured activities and some quieter ones. For instance, my weekend mornings might be spent tending to the garden – there's something therapeutic about getting out among the plants and watching them grow. Then later, we'll have a family gathering or visit our grandkids, which is always lively and full of laughter. And in between, I try to squeeze in some reading or perhaps a spot of baking – I find those little moments really enjoyable. It helps me feel fulfilled and refreshed before the afternoon slump sets in. On weekdays, my evenings usually start winding down with a bit of television or listening to radio, maybe catching up on current events. If I'm feeling particularly inspired, I might whip up one of my famous scones while keeping an ear tuned into some history docos or nature programmes. All these different aspects of my life allow me to avoid monotony and make sure every day has its unique rhythm."
828,"I have a little notebook where I jot down my daily plans, including any fun activities like going out for tea with the girls or playing bridge with my grandkids. It helps me stay organised and ensures I don't forget what we're supposed to be doing today. Occasionally, I'll make notes on gardening progress too – keeping track of which seeds need planting and harvesting. My daughter likes coming into our sitting room and looking at them; she says it's her favourite thing to do before bedtime!"
867,"I'm a bit of an old-fashioned person, I suppose! *laughs* But seriously, I find that having routines helps me stay organised. Every morning, before my husband sadly passed away, we'd sit together and plan out our daily schedules, including mine, so I knew exactly what needed to be done each day. Since he was gone, my granddaughter has been very helpful, checking in regularly to make sure everything is running smoothly here. In terms of actual organisation, I have a calendar where I jot down all my appointments, doctor's visits, and any other regular tasks like grocery shopping or tidying the house. It's quite simple, really – nothing too fancy. And, of course, I always try to put things into perspective; remember, I'm 70 now, and some things aren't worth stressing about! My secretaries work lives were probably more hectic than my current relaxed pace, but even back then, I found value in making lists, prioritising tasks, and breaking them down into manageable chunks. The key, in my opinion, is finding what works for you and sticking to it. Now, I might rely less on paper calendars and more on reminders on my tablet – though sometimes those still drive me a tad mad because I struggle keeping track of"
926,"I start my morning with a nice cuppa tea, sit quietly for a bit to gather my thoughts while enjoying the sunshine streaming into the room. After that, I usually spend some time checking emails, responding to any urgent messages, and perhaps making a mental note of what I need to tackle during the day. Sometimes I'll glance over my calendar to check if there are any upcoming appointments or meetings I should be aware of. It really helps me feel more centered and prepared for whatever comes ahead."
928,"I think my main focus has been trying to reduce heat loss where possible, especially since I live in a rather draughty old terraced house. So, I make sure all windows are closed during cold snaps, put draught excluders round doors, and have added some insulation to loft space recently. We've also got an older boiler which isn't exactly fuel-efficient, so we're looking into replacing it soon. My son does try to be mindful too; he knows how much heating costs me. I'm not keen on spending money unnecessarily, though! Still, every little bit helps, and I suppose using thick curtains or blinds when needed makes a difference. Simple measures like these really add up in the end."
932,"I must admit, I'm still getting used to all these smart devices, but my grandkids have helped me set them up. They think it's quite clever having a voice assistant like Alexa to control everything. However, I find myself avoiding using it most of the time because, between you and me, I prefer simple solutions. Still, it does make some things easier, especially when my memory isn't what it used to be – like remembering to turn lights on/off or adjusting the thermostat. To be honest, I struggle with updating software and figuring out how certain features work. My son helps occasionally, so I appreciate his guidance. But overall, I'd say our smart home setup is more functional than exciting; we mainly stick to the basics and try not to complicate things too much."
954,"I think prioritising is quite simple, really. You have to weigh what's most important against what can wait a bit longer. For instance, my grandkids will always come first – making sure they're happy and growing strong takes precedence. After that, taking care of myself and keeping the garden tidy comes into play. If there's something specific that needs fixing or maintenance, like the washing machine, I'll make space for that too, but only if it affects daily routines significantly. It's all about finding balance, isn't it? Sometimes having some flexibility helps – being able to adapt and adjust priorities based on changing circumstances makes a big difference."
