id,text
638,"I think my approach is quite methodical and step-by-step. I like to break things down into smaller parts, consider all sides of an argument before forming a conclusion, and make sure there aren't any obvious solutions that have been overlooked. It helps me feel more grounded and certain about what I'm saying. Sometimes people tell me I'm too indecisive because I weigh everything so heavily, but I suppose that's part of being a bit of a perfectionist!"
668,"I find that writing things down helps me to process my thoughts and organize them better. When I'm faced with a complex issue or decision, I like to jot down key points and concerns, then review them afterwards. Sometimes, talking through what I've written with someone else will give me clarity too – whether that's a grandchild, a close friend, or even myself in conversation. It really is saying ""the why"" that gets me going, rather than just listing facts out; there has to be an underlying reason behind everything we're discussing."
679,"I think identifying areas for growth is quite a process for me, actually. You know, I'm a bit like my grandmother used to say, ""A penny saved is a penny earned."" But sometimes I find myself wondering what other investments could be made – whether that's in personal development or simply being more efficient in everyday life. For instance, with all the changes happening in our world today, I feel like there must be so many opportunities to improve ourselves, to adapt and become better versions of who we already are. And yet, I have to admit that I still struggle with keeping up-to-date with new technologies, even though everyone seems to be using them all the time! It makes me chuckle; I remember getting frustrated with those computer classes I had to take in secretarial college because I was so out of touch. Another area where I'd love some improvement is perhaps becoming more digitally savvy. While I manage to navigate most aspects of digital life pretty well, there are certain intricacies that seem to stump me. My grandsons always tease me about asking too many questions, which might make it sound silly, but honestly, it's reassuring knowing someone like them can guide me along! Lastly, while I value tradition and familiarity above all else, having been married for such"
682,"I think my strategy is quite simple really. You know, I've found that a bit of caution never hurts, so I tend to take things slowly and consider all angles before jumping into something completely new. But once I feel like I have enough information and an idea of what's involved, I try to be open-minded and give it a go. And I always say that patience and curiosity can get you much farther than rushing through life. It sounds daft, perhaps, but it seems to work for me!"
722,"I make sure to prioritise my reading, really. As a retiree, I have more free time now, so I try to utilise it wisely. In the morning, before getting started with other daily chores, I like to sit quietly with a cuppa and some reading material – usually historical fiction or biographies. The quieter it is, the better I feel! My husband used to always say I was most productive during those first couple of hours of the day. And of course, I take advantage of any breaks I get throughout the day, too. Whether it's while waiting in line or sitting on the bus, I'll pull out my e-reader or bring along a paperback. It helps me unwind, relax and escape into another world. Plus, it keeps my mind sharp, which is essential for an oldie like myself!"
726,"I tend to find out about new authors or genres through word-of-mouth recommendations from people close to me, like my son, his wife, or our mutual friends. Sometimes I'll pick up a book based on its cover design or reviews from reputable sources, like The Guardian or The Times Literary Supplement. Occasionally, I might stumble upon something while browsing in a second-hand bookstore or library sale – there's still magic in discovering hidden gems among those shelves! But really, most importantly, I rely on being asked what books others have enjoyed; I love discussing literature with fellow readers and getting tailored suggestions."
737,"I find myself often tidying away any clutter or organizing my workspace while listening to music, usually classical or traditional folk tunes. It helps me focus and gets everything sorted out before a busy morning. Occasionally, I might be sewing something or fixing up the garden while listening to music; there's something soothing about having some gentle sounds playing in the background."
743,"I must say, I'm a bit of an auditory learner myself. When I have some time to kill during my daily commute, either to work or out for a walk, I find I thoroughly enjoy listening to podcasts or audiobooks. It's wonderful how something like music isn't really available when one is actively engaging physically; however, being able to absorb information while still using both hands has been quite liberating! Audiobooks allow me to make the most of downtime, whether it be sitting quietly on my sofa waiting for visitors, riding the bus into town, or even tending to my vegetable patch – whatever suits best for that particular moment. As long as there's someone narrating, providing interesting insights, and keeping my mind occupied, I think I'm perfectly happy."
750,"I love staying active! You know, people say retirement is all relaxation, but that isn't really true for me. There's always something to be done, whether it's tending to my garden or getting out and seeing what's going on locally. My grandkids come round regularly, so we have a lovely time playing games together or having picnics in the park. In fact, one thing I'm looking forward to soon is taking part in an organised gardening course – maybe even growing some exotic plants! It'll give me chance to meet like-minded folk and pick up some tips from experts. Nothing beats being outdoors though; there's nothing quite like feeling the sun on your face and watching those little seeds sprout into beautiful blooms. Occasionally, I might pop into the local community centre to join in with whatever activity's available – usually a bit of exercise class or perhaps attending a workshop. Those sorts of things keep me sociable while still keeping me moving. And let's not forget books! A good novel or biography always seems to transport me somewhere else and gets my imagination running wild. So, yes, staying active has become such an essential part of my daily routine now – keeps me young, happy, and fulfilled."
758,"I really value my time alone, actually. It's a chance for me to recharge and think clearly, without any distractions. You know, people tend to assume that being an extrovert is necessary for enjoyment, but I'm happy to spend hours curled up with a good book or tending to my garden. There's something peaceful about sitting quietly, surrounded by nature, watching the world go by. Of course, it's lovely to have company sometimes too – like spending time with loved ones or attending local events – but there's definitely something special about having some space all to myself."
797,"When trying a new cuisine, I'm always excited to discover something different, so I like to start with a dish I think might be relatively accessible. Maybe one my grandkids have mentioned is popular, or a recipe we've seen on television. If it seems simple enough, I'll give it a go. Sometimes, I ask them to help me prepare it – they're great at measuring out ingredients! They love being involved, and it makes the process more enjoyable. Even if it turns out okay, rather than perfect, there's usually some element of satisfaction knowing we tried something new together. And who knows, sometimes it becomes a favourite!"
818,"I think creating variety is key to keeping me going, even though some might say I'm a bit set in my ways! *laughs* For one thing, I try to mix between indoor and outdoor activities – whether it's tending to my vegetable patch out in the garden, which always brings something fresh air into my daily routine, or sitting indoors enjoying a cuppa while sorting through an interesting book or magazine. In terms of specific hobbies, I love getting together with fellow readers at our local book club; we all meet monthly to discuss whatever novel or biography has piqued us since the last meeting. It's great chatting with like-minded people who share similar tastes in literature. Occasionally, too, I'll take part in some charity work at our community center – nothing major, really, but it helps remind me there's still so much to give back, even at my stage in life. If I have free time during the weekdays, I usually plan ahead and squeeze in some gardening, either pruning plants or planting seeds for future harvests. If the weather permits, I may join some mates for a walk along the nearby canal, watching birds, watching the world go by... these little breaks always refresh me. Lastly, cooking for loved ones does bring joy too."
828,"I'm quite particular about keeping track of my free time, even though some might think me a bit old-fashioned! I like jotting notes in a notebook whenever something comes to mind – be it what I read, who we have for dinner, or plans made with friends. It helps me feel more organised and ensures nothing falls through the cracks. Occasionally, I'll glance through last month's or so entries to remind myself how much I've been enjoying our little book club meetings or how many nice walks I took during the summer months. Simple pleasures make such an impact on one's mental health, don't you agree?"
867,"I'm quite particular about keeping my space tidy and organized. I like having a bit of routine, so every morning I make sure to plan out my day, prioritise what needs to be done, and check my list before starting any tasks. This helps me stay focused and avoid feeling overwhelmed. My trusty calendar is always filled with reminders, meetings, and appointments – either on paper or digitally, whichever suits best. And of course, there's nothing more satisfying than ticking off completed tasks! My grandkids even love seeing how many items we tick off together during our daily checks. For personal records and paperwork, I have designated folders labeled clearly and colour-coded, which makes them easy to find when needed. I try to sort documents into categories whenever I receive something – bills, receipts, letters... and update everything regularly so nothing gets lost or misplaced. In addition to these methods, I also value simple tools like sticky notes, to-do lists, and a decent planner to jot down quick notes throughout the day. It might seem old-fashioned, but sometimes those little scribbled notes prove invaluable! Overall, while technology has certainly changed the way people work, some tried-and-tested practices never go astray, and I believe a combination of traditional techniques works really well for me"
926,"I like starting my day a bit later nowadays. After getting dressed, I make myself a cuppa tea, sit down, and spend some time checking emails, responding to any urgent messages, and catching up on local news via my BBC radio app – always seems to be an easy way to stay informed without too much fuss. Then I take a quick glance out into the garden while enjoying my tea; usually check how everything is looking outside, making sure nothing untoward has happened overnight. Once done, I grab my bag, add what I need, and set off onto my daily commute using our local bus service. It takes me about half an hour to reach town where I have various places to visit such as the post office, library, and sometimes meetings with acquaintances or grandkids who live nearby. Sometimes we might pop into a café for something tasty for breakfast – although I try to stick to simple fare. By midmorning, I'm usually ready for another productive session!"
928,"I try to be mindful of my usage, turning lights out when not needed and using thermal curtains during winter. We have double glazing, which helps a lot. In summer, we open our windows slightly at night to let the cool air in before closing them again during the day. My grandkids like sitting outside while we watch telly together; it makes me think twice about heating the living room too much! Simple measures make a difference, and I find it's all about finding a balance between comfort and saving money."
932,"To be honest, I'm still getting used to them all. My son helped me set one up a bit, but now he's always saying ""Mum, why didn't you figure out how to turn on the lights?"" You know! It's funny. The main thing is, I love having some assistance, like telling Alexa what room to play music in, so I only have to give instructions once rather than fiddling around. But sometimes I feel like there must be an easier way...I mean, my brain gets muddled enough already! Still, it's nice to not have to remember everything myself. Just wish they could make them more user-friendly for someone who's not too tech-savvy, like me!"
954,"I think prioritising is all about weighing what's most important to me against my limited capacity and resources. For instance, since becoming a widow six years ago, I have more freedom to focus on myself now. So, making sure I'm keeping fit, spending quality time with my grandkids, and enjoying some hobbies like gardening come top. On the other hand, there are still responsibilities – managing my finances, staying organised, looking after my health... those need balancing too. When faced with multiple demands, I try breaking them down into manageable chunks. If one task takes longer, I might put others on hold temporarily until I complete it. And generally speaking, once something becomes urgent, I make space for it, even if it means adjusting smaller plans. It's really about finding common ground between individual priorities and being flexible enough to adjust course when needed. Simple solutions usually work best for me; getting bogged down in complicated decisions tends to cause unnecessary stress!"
